<?xml version="1.0" encoding="UTF-8"?>
<games xmlns:xsi="http://www.w3.org/2001/XMLSchema-instance" xsi:noNamespaceSchemaLocation="games.xsd" majorVersion="1" minorVersion="2" date="2012-01-14T08:40:15">
  <!--This file contains mods for other games-->
  <game name="CinematicMod10HL2" platform="Windows">
    <title>Cinematic Mod 10 (Half-Life 2 Mod)</title>
    <location_path environment_variable="steamsourcemods" path="FAKEFACTORY_CM10\hl2"/>
    <save path="SAVE"/>
    <contributor>SanMadJack</contributor>
  </game>
  <game name="CinematicMod10HL2Ep1" platform="Windows">
    <title>Cinematic Mod 10 (Half-Life 2: Episode 1 Mod)</title>
    <location_path environment_variable="steamsourcemods" path="FAKEFACTORY_CM10\episodic"/>
    <save path="SAVE"/>
    <contributor>SanMadJack</contributor>
  </game>
  <game name="CinematicMod10HL2Ep2" platform="Windows">
    <title>Cinematic Mod 10 (Half-Life 2: Episode 2 Mod)</title>
    <location_path environment_variable="steamsourcemods" path="FAKEFACTORY_CM10\ep2"/>
    <save path="SAVE"/>
    <contributor>SanMadJack</contributor>
  </game>
  <game name="Flesh" platform="Windows">
    <title>Flesh (Source Mod)</title>
    <location_path environment_variable="steamsourcemods" path="Flesh"/>
    <save path="SAVE"/>
    <contributor>SanMadJack</contributor>
  </game>
  <game name="NamelessMod" platform="Windows">
    <title>The Nameless Mod (Deus Ex Mod)</title>
    <location_shortcut environment_variable="startmenu" path="Programs\The Nameless Mod\The Nameless Mod.lnk" append="TNM" detract="System"/>
    <location_game name="DeusEx" platform="Windows" append="TNM"/>
    <save path="System" filename="*.ini" type="Settings"/>
    <save path="Save"/>
    <contributor>Trestkon</contributor>
  </game>
  <game name="ResearchAndDevelopment" platform="Windows">
    <title>Research and Development (Source Mod)</title>
    <location_path environment_variable="steamsourcemods" path="Research and Development"/>
    <save path="SAVE"/>
    <contributor>SanMadJack</contributor>
  </game>
  <game name="TitanXCIX1" platform="Steam">
    <title>Titan: XCIX - Part 1</title>
    <location_path environment_variable="steamsourcemods" path="SurvivorIZ"/>
    <save path="SAVE"/>
    <contributor>Arc Angel</contributor>
  </game>
</games>
