<?xml version="1.0" encoding="utf-8"?>
<games xmlns:xsi="http://www.w3.org/2001/XMLSchema-instance" xsi:noNamespaceSchemaLocation="games.xsd"
	majorVersion="1" minorVersion="1"  date="2011-12-25T00:00:00">
  <game name="TesPSGame" platform="PS2">
    <title>Test PS Game</title>
    <ps_code prefix="SLUS" suffix="90210"/>
  </game>
  <game name="TestGame" platform="Windows" region="EUR" deprecated="true">
    <title>Test Game 4</title>
    <location_registry root="local_machine" key="SOFTWARE\Activision\Activenet\Applications\1060.2.1" value="Cwd" append="BLAH"/>
    <location_shortcut environment_variable="startmenu" path="Programs\Titanium\Mercenaries\Play Mercenaries.lnk" detract="splash" deprecated="true"/>
    <location_path environment_variable="installlocation" path="Activision\Titanium\Mercenaries" platform_version="Vista" />
    <location_path environment_variable="installlocation" path="MechVM\games\mw2-mercs-tt" platform_version="XP"/>
    <location_game name="TesPSGame" platform="PS2"/>
    <identifier path="mek"/>
    <save path="mek" type="Mechs" />
    <save filename="userstar.bwd" />
    <save filename="MW2PRM.CFG" type="Settings" modified_after="1923-12-01T12:00:00" />
    <save filename="MW2REG.CFG" type="Settings" />
    <ignore path="temp"/>
    <ignore path="temp2" type="seteter"/>
    <virtualstore override="true" />
    <require_detection />
    <comment>This is a comment</comment>
    <restore_comment>This is a restore comment</restore_comment>
    <contributor>SanMadJack</contributor>
  </game>
</games>