<?xml version="1.0" encoding="UTF-8"?>
<games xmlns:xsi="http://www.w3.org/2001/XMLSchema-instance" xsi:noNamespaceSchemaLocation="games.xsd" majorVersion="1" minorVersion="2" date="2012-01-14T08:40:15">
  <!--This file contains PlayStation games-->
  <game name="ChronoCross" platform="PS1" region="USA">
    <title>Chrono Cross</title>
    <ps_code prefix="SLUS" suffix="01041"/>
    <ps_code prefix="SLUS" suffix="01080"/>
    <contributor>SanMadJack</contributor>
  </game>
  <game name="ChronoTrigger" platform="PS1" region="USA">
    <title>Chrono Trigger</title>
    <ps_code prefix="SLUS" suffix="01363"/>
    <contributor>SanMadJack</contributor>
  </game>
  <game name="Descent" platform="PS1" region="USA">
    <title>Descent</title>
    <ps_code prefix="SLUS" suffix="00037"/>
    <contributor>SanMadJack</contributor>
  </game>
  <game name="DescentMaximum" platform="PS1" region="USA">
    <title>Descent: Maximum</title>
    <ps_code prefix="SLUS" suffix="00460"/>
    <contributor>SanMadJack</contributor>
  </game>
  <game name="FearEffect" platform="PS1" region="USA">
    <title>Fear Effect</title>
    <ps_code prefix="SLUS" suffix="00920"/>
    <ps_code prefix="SLUS" suffix="01056"/>
    <ps_code prefix="SLUS" suffix="01057"/>
    <ps_code prefix="SLUS" suffix="01058"/>
    <contributor>SanMadJack</contributor>
  </game>
  <game name="FearEffect2" platform="PS1" region="USA">
    <title>Fear Effect 2: Retro Helix</title>
    <ps_code prefix="SLUS" suffix="01266"/>
    <ps_code prefix="SLUS" suffix="01275"/>
    <ps_code prefix="SLUS" suffix="01276"/>
    <ps_code prefix="SLUS" suffix="01277"/>
    <contributor>SanMadJack</contributor>
  </game>
  <game name="FinalFantasy4" platform="PS1" region="USA">
    <title>Final Fantasy IV</title>
    <ps_code prefix="SLUS" suffix="01360"/>
    <contributor>SanMadJack</contributor>
  </game>
  <game name="FinalFantasy7" platform="PS1" region="USA">
    <title>Final Fantasy VII</title>
    <ps_code prefix="SCUS" suffix="94163"/>
    <contributor>SanMadJack</contributor>
  </game>
  <game name="FinalFantasy8" platform="PS1" region="USA">
    <title>Final Fantasy VIII</title>
    <ps_code prefix="SLUS" suffix="00892"/>
    <ps_code prefix="SLUS" suffix="00908"/>
    <ps_code prefix="SLUS" suffix="00909"/>
    <ps_code prefix="SLUS" suffix="00910"/>
    <contributor>SanMadJack</contributor>
  </game>
  <game name="FinalFantasy9" platform="PS1" region="USA">
    <title>Final Fantasy IX</title>
    <ps_code prefix="SLUS" suffix="01251"/>
    <ps_code prefix="SLUS" suffix="01295"/>
    <ps_code prefix="SLUS" suffix="01296"/>
    <ps_code prefix="SLUS" suffix="01297"/>
    <contributor>SanMadJack</contributor>
  </game>
  <game name="FinalFantasyTactics" platform="PS1" region="USA">
    <title>Final Fantasy Tactics</title>
    <ps_code prefix="SLUS" suffix="94221"/>
    <contributor>SanMadJack</contributor>
  </game>
  <game name="MetalGearSolid" platform="PS1" region="USA">
    <title>Metal Gear Solid</title>
    <ps_code prefix="SLUS" suffix="00594"/>
    <ps_code prefix="SLUS" suffix="00776"/>
    <contributor>SanMadJack</contributor>
  </game>
  <game name="MetalGearSolidVRMissions" platform="PS1" region="USA">
    <title>Metal Gear Solid: VR Missions</title>
    <ps_code prefix="SLUS" suffix="00957"/>
    <contributor>SanMadJack</contributor>
  </game>
  <game name="ParasiteEve" platform="PS1" region="USA">
    <title>Parasite Eve</title>
    <ps_code prefix="SLUS" suffix="00662"/>
    <ps_code prefix="SLUS" suffix="00668"/>
    <contributor>SanMadJack</contributor>
  </game>
  <game name="ParasiteEve2" platform="PS1" region="USA">
    <title>Parasite Eve II</title>
    <ps_code prefix="SLUS" suffix="01042"/>
    <ps_code prefix="SLUS" suffix="01055"/>
    <contributor>SanMadJack</contributor>
  </game>
  <game name="SilentHill" platform="PS1" region="USA">
    <title>Silent Hill</title>
    <ps_code prefix="SLUS" suffix="00707"/>
    <contributor>SanMadJack</contributor>
  </game>
  <game name="SoulBlade" platform="PS1" region="USA">
    <title>Soul Blade</title>
    <ps_code prefix="SLUS" suffix="00240"/>
    <contributor>SanMadJack</contributor>
  </game>
</games>
