<?xml version="1.0" encoding="utf-8"?>
<games xmlns:xsi="http://www.w3.org/2001/XMLSchema-instance" xsi:noNamespaceSchemaLocation="games.xsd" majorVersion="1" minorVersion="2" date="2011-12-25T00:00:00">
  <!--This file contains PlayStation 3 games-->
  <game name="AssassinsCreed" platform="PS3" region="USA">
    <title>Assassin's Creed</title>
    <ps_code prefix="BLUS" suffix="30089"/>
    <contributor>SanMadJack</contributor>
  </game>
  <game name="AssassinsCreedBrotherhood" platform="PS3" region="EUR">
    <title>Assassin's Creed: Brotherhood</title>
    <ps_code prefix="BLES" suffix="00909" />
    <contributor>AdmiringWorm</contributor>
  </game>
  <game name="AssassinsCreedRevelations" platform="PS3" region="EUR">
    <title>Assassin's Creed: Revelations</title>
    <ps_code prefix="BLES" suffix="01384"/>
    <contributor>AdmiringWorm</contributor>
  </game>
  <game name="BattlefieldBadcompany" platform="PS3" region="USA">
    <title>Battlefield: Bad Company</title>
    <ps_code prefix="BLUS" suffix="30118"/>
    <contributor>SanMadJack</contributor>
  </game>
  <game name="BrutalLegend" platform="PS3" region="USA">
    <title>Br√ºtal Legend</title>
    <ps_code prefix="BLUS" suffix="30330"/>
    <contributor>SanMadJack</contributor>
  </game>
  <game name="CivilizationRevolution" platform="PS3" region="USA">
    <title>Sid Meier's Civilization: Revolution</title>
    <ps_code prefix="BLUS" suffix="30130"/>
    <contributor>SanMadJack</contributor>
  </game>
  <game name="Darkness" platform="PS3" region="USA">
    <title>The Darkness</title>
    <ps_code prefix="BLUS" suffix="30035"/>
    <contributor>SanMadJack</contributor>
  </game>
  <game name="DeadSpace" platform="PS3" region="USA">
    <title>Dead Space</title>
    <ps_code prefix="BLUS" suffix="30177"/>
    <contributor>SanMadJack</contributor>
  </game>
  <game name="DevilMayCry4" platform="PS3" region="USA">
    <title>Devil May Cry 4</title>
    <ps_code prefix="BLUS" suffix="30092"/>
    <contributor>SanMadJack</contributor>
  </game>
  <game name="Echochrome" platform="PS3" region="USA">
    <title>Echochrome</title>
    <ps_code prefix="NPUA" suffix="80134"/>
    <contributor>SanMadJack</contributor>
  </game>
  <game name="ElderScrolls4Oblivion" platform="PS3" region="USA">
    <title>The Elder Scrolls IV: Oblivion</title>
    <ps_code prefix="BLUS" suffix="30007"/>
    <contributor>SanMadJack</contributor>
  </game>
  <game name="Elefunk" platform="PS3" region="USA">
    <title>Elefunk</title>
    <ps_code prefix="NPUA" suffix="80157"/>
    <contributor>SanMadJack</contributor>
  </game>
  <game name="EternalSonata" platform="PS3" region="USA">
    <title>Eternal Sonata</title>
    <ps_code prefix="BLUS" suffix="30161"/>
    <contributor>SanMadJack</contributor>
  </game>
  <game name="FinalFantasy13" platform="PS3" region="USA">
    <title>Final Fantasy XIII</title>
    <ps_code prefix="MRTC" suffix="00003"/>
    <contributor>SanMadJack</contributor>
  </game>
  <game name="FinalFantasy13-2" platform="PS3" region="EUR">
    <title>Final Fantasy XIII-2</title>
    <ps_code prefix="BLES" suffix="01269"/>
    <contributor>AdmiringWorm</contributor>
  </game>
  <game name="Flow" platform="PS3" region="USA">
    <title>Flow</title>
    <ps_code prefix="NPUA" suffix="80001"/>
    <contributor>SanMadJack</contributor>
  </game>
  <game name="Flower" platform="PS3" region="USA">
    <title>Flower</title>
    <ps_code prefix="NPUA" suffix="80083"/>
    <contributor>SanMadJack</contributor>
  </game>
  <game name="Flower" platform="PS3" region="EUR">
    <title>Flower</title>
    <ps_code prefix="NPEA" suffix="00094"/>
    <contributor>AdmiringWorm</contributor>
  </game>
  <game name="Folklore" platform="PS3" region="USA">
    <title>Folklore</title>
    <ps_code prefix="BCUS" suffix="98147"/>
    <contributor>SanMadJack</contributor>
  </game>
  <game name="HeavenlySword" platform="PS3" region="USA">
    <title>Heavenly Sword</title>
    <ps_code prefix="BCUS" suffix="98132"/>
    <contributor>SanMadJack</contributor>
  </game>
  <game name="inFamous" platform="PS3" region="USA">
    <title>inFamous</title>
    <ps_code prefix="BCUS" suffix="98119"/>
    <contributor>SanMadJack</contributor>
  </game>
  <game name="InFamous" platform="PS3" region="EUR">
    <title>inFamous</title>
    <ps_code prefix="BCES" suffix="00609"/>
    <contributor>AdmiringWorm</contributor>
  </game>
  <game name="Jeopardy" platform="PS3" region="USA">
    <title>Jeopardy!</title>
    <ps_code prefix="NPUA" suffix="80227"/>
    <contributor>SanMadJack</contributor>
  </game>
  <game name="Lemmings" platform="PS3" region="USA">
    <title>Lemmings</title>
    <ps_code prefix="NPUA" suffix="80012"/>
    <contributor>SanMadJack</contributor>
  </game>
  <game name="LuminesSupernova" platform="PS3" region="USA">
    <title>Lumines Supernova</title>
    <ps_code prefix="NPUB" suffix="30048"/>
    <contributor>SanMadJack</contributor>
  </game>
  <game name="MirrorsEdge" platform="PS3" region="USA">
    <title>Mirror's Edge</title>
    <ps_code prefix="BLUS" suffix="30179"/>
    <contributor>SanMadJack</contributor>
  </game>
  <game name="PrinceOfPersia2008" platform="PS3" region="USA">
    <title>Prince of Persia (2008)</title>
    <ps_code prefix="BLUS" suffix="30214"/>
    <contributor>SanMadJack</contributor>
  </game>
  <game name="RagDollKungFuFistsOfPlastic" platform="PS3" region="USA">
    <title>Rag Doll Kung Fu: Fists of Plastic</title>
    <ps_code prefix="NPUA" suffix="80217"/>
    <contributor>SanMadJack</contributor>
  </game>
  <game name="RatchetClankFutureQuestForBooty" platform="PS3" region="USA">
    <title>Ratchet &amp; Clank Future: Quest For Booty</title>
    <ps_code prefix="NPUA" suffix="80145"/>
    <contributor>SanMadJack</contributor>
  </game>
  <game name="RatchetClankFutureToolsOfDestruction" platform="PS3" region="USA">
    <title>Ratchet &amp; Clank Future: Tools of Destruction</title>
    <ps_code prefix="BCUS" suffix="98127"/>
    <contributor>SanMadJack</contributor>
  </game>
  <game name="RedFactionGuerrilla" platform="PS3" region="USA">
    <title>Red Faction: Guerrilla</title>
    <ps_code prefix="BLUS" suffix="30258"/>
    <contributor>SanMadJack</contributor>
  </game>
  <game name="ResidentEvil5" platform="PS3" region="USA">
    <title>Resident Evil 5</title>
    <ps_code prefix="BLUS" suffix="30270"/>
    <contributor>SanMadJack</contributor>
  </game>
  <game name="Resistance2" platform="PS3" region="USA">
    <title>Resistance 2</title>
    <ps_code prefix="BCUS" suffix="98120"/>
    <contributor>SanMadJack</contributor>
  </game>
  <game name="ResistanceFallOfMan" platform="PS3" region="USA">
    <title>Resistance: Fall of Man</title>
    <ps_code prefix="BCUS" suffix="98107"/>
    <contributor>SanMadJack</contributor>
  </game>
  <game name="SavageMoon" platform="PS3" region="USA">
    <title>Savage Moon</title>
    <ps_code prefix="NPUA" suffix="80228"/>
    <contributor>SanMadJack</contributor>
  </game>
  <game name="Shatter" platform="PS3" region="USA">
    <title>Shatter</title>
    <ps_code prefix="NPUB" suffix="30091"/>
    <contributor>SanMadJack</contributor>
  </game>
  <game name="SilentHillHomecoming" platform="PS3" region="USA">
    <title>Silent Hill: Homecoming</title>
    <ps_code prefix="BLUS" suffix="30169"/>
    <contributor>SanMadJack</contributor>
  </game>
  <game name="SoulCalibur4" platform="PS3" region="USA">
    <title>Soul Calibur IV</title>
    <ps_code prefix="BLUS" suffix="30160"/>
    <contributor>SanMadJack</contributor>
  </game>
  <game name="SuperStardustHD" platform="PS3" region="USA">
    <title>Super Stardust HD</title>
    <ps_code prefix="NPUA" suffix="80068"/>
    <contributor>SanMadJack</contributor>
  </game>
  <game name="UltimateAlliance" platform="PS3" region="USA">
    <title>Ultimate Alliance</title>
    <ps_code prefix="BLUS" suffix="30010"/>
    <contributor>SanMadJack</contributor>
  </game>
  <game name="UnchartedDrakesFortune" platform="PS3" region="USA">
    <title>Uncharted: Drake's Fortune</title>
    <ps_code prefix="BCUS" suffix="98103"/>
    <contributor>SanMadJack</contributor>
  </game>
  <game name="UnchartedDrakesFortune" platform="PS3" region="EUR">
    <title>Uncharted: Drake's Fortune</title>
    <ps_code prefix="BCES" suffix="00065"/>
    <contributor>AdmiringWorm</contributor>
  </game>
  <game name="UnrealTournament3" platform="PS3" region="USA">
    <title>Unreal Tournament III</title>
    <ps_code prefix="BLUS" suffix="30086"/>
    <contributor>SanMadJack</contributor>
  </game>
  <game name="ValkyriaChronicles" platform="PS3" region="USA">
    <title>Valkyria Chronicles</title>
    <ps_code prefix="BLUS" suffix="30196"/>
    <contributor>SanMadJack</contributor>
  </game>
  <game name="ValkyriaChronicles" platform="PS3" region="EUR">
    <title>Valkyria Chronicles</title>
    <ps_code prefix="BLES" suffix="00372"/>
    <contributor>AdmiringWorm</contributor>
  </game>
  <game name="WheelOfFortune" platform="PS3" region="USA">
    <title>Wheel of Fortune</title>
    <ps_code prefix="NPUA" suffix="80137"/>
    <contributor>SanMadJack</contributor>
  </game>
  <game name="Wolfenstein3D" platform="PS3" region="USA">
    <title>Wolfenstein 3D</title>
    <ps_code prefix="NPUB" suffix="30074"/>
    <contributor>SanMadJack</contributor>
  </game>
</games>
